[
  {
    "state_id": "DL",
    "name": "Delhi",
    "type": "Union Territory",
    "capital": "New Delhi",
    "assembly_constituencies": 70,
    "lok_sabha_constituencies": 7,
    "current_cm": null,
    "current_ruling_party": "Bharatiya Janata Party",
    "last_election": "2025-02-05",
    "next_election": "2030-02",
    "population": 32900000,
    "area_sq_km": 1484,
    "literacy_rate": 86.34,
    "official_languages": ["Hindi", "English", "Punjabi", "Urdu"]
  }
]
